{"$id":"https://awesome-theorems.invalid/schemas/stage5-theorem-worker-result-1.0.json","$schema":"https://json-schema.org/draft/2020-12/schema","additionalProperties":false,"properties":{"artifacts":{"items":{"additionalProperties":false,"properties":{"media_type":{"minLength":1,"type":"string"},"path":{"minLength":1,"type":"string"},"sha256":{"minLength":1,"pattern":"^[0-9a-f]{64}$","type":"string"},"size_bytes":{"minimum":0,"type":"integer"}},"required":["path","sha256","size_bytes","media_type"],"type":"object"},"minItems":1,"type":"array","uniqueItems":true},"authority_sha256":{"minLength":1,"pattern":"^[0-9a-f]{64}$","type":"string"},"baseline_sha256":{"minLength":1,"pattern":"^[0-9a-f]{64}$","type":"string"},"changed_paths":{"items":{"minLength":1,"type":"string"},"minItems":1,"type":"array","uniqueItems":true},"claim_card_sha256":{"minLength":1,"pattern":"^[0-9a-f]{64}$","type":"string"},"claim_id":{"minLength":1,"pattern":"^[A-Za-z0-9][A-Za-z0-9._:@-]{0,199}$","type":"string"},"command_outcomes":{"items":{"additionalProperties":false,"properties":{"argv_sha256":{"minLength":1,"pattern":"^[0-9a-f]{64}$","type":"string"},"command_id":{"minLength":1,"pattern":"^[A-Za-z0-9][A-Za-z0-9._:@-]{0,199}$","type":"string"},"exit_code":{"const":0,"minimum":0,"type":"integer"},"finished_at":{"format":"date-time","minLength":1,"pattern":"^.+Z$","type":"string"},"passed":{"const":true,"type":"boolean"},"started_at":{"format":"date-time","minLength":1,"pattern":"^.+Z$","type":"string"},"stderr_sha256":{"minLength":1,"pattern":"^[0-9a-f]{64}$","type":"string"},"stdout_sha256":{"minLength":1,"pattern":"^[0-9a-f]{64}$","type":"string"}},"required":["command_id","argv_sha256","exit_code","passed","stdout_sha256","stderr_sha256","started_at","finished_at"],"type":"object"},"minItems":1,"type":"array","uniqueItems":true},"completed_at":{"format":"date-time","minLength":1,"pattern":"^.+Z$","type":"string"},"item_id":{"minLength":1,"pattern":"^[A-Za-z0-9][A-Za-z0-9._:@-]{0,199}$","type":"string"},"mode":{"minLength":1,"pattern":"^[A-Z][A-Z0-9-]{0,63}$","type":"string"},"patch":{"additionalProperties":false,"properties":{"path":{"minLength":1,"type":"string"},"sha256":{"minLength":1,"pattern":"^[0-9a-f]{64}$","type":"string"},"size_bytes":{"minimum":1,"type":"integer"}},"required":["path","sha256","size_bytes"],"type":"object"},"program":{"minLength":1,"type":"string"},"run_id":{"minLength":1,"pattern":"^[A-Za-z0-9][A-Za-z0-9._:@-]{0,199}$","type":"string"},"schema_version":{"const":"awesome-theorems/stage5-proof-debt-worker-result/1.0","minLength":1,"type":"string"},"status":{"const":"self_tested","minLength":1,"type":"string"}},"required":["schema_version","program","claim_id","run_id","item_id","mode","claim_card_sha256","baseline_sha256","status","changed_paths","patch","command_outcomes","artifacts","completed_at","authority_sha256"],"type":"object"}