{"artifacts":[{"media_type":"application/json","path":"/home/sansha/Github/awesome_theorems/.ops/stage5-theorems-execution-v2/tasks/S5THM-00003735-TARGET--worker/r-1786776207-a21a734a/work/Stage5_Theorem_Instances/S5-CLM-00003735/intake.json","sha256":"55d44c54d91ef1410dfd5d513f8dd946bd14a7a1fc0dceb8dc1025a50417abc7","size_bytes":1417},{"media_type":"text/x-lean","path":"/home/sansha/Github/awesome_theorems/.ops/stage5-theorems-execution-v2/tasks/S5THM-00003735-TARGET--worker/r-1786776207-a21a734a/work/Formalizations/Lean/AwesomeTheorems/Stage5/Theorems/S5_CLM_00003735/Statement.lean","sha256":"379ef34d32e9bf4a68ef23730c0afb1454525cdf212ebd3428463ac0a445b794","size_bytes":900},{"media_type":"application/json","path":"/home/sansha/Github/awesome_theorems/.ops/stage5-theorems-execution-v2/tasks/S5THM-00003735-TARGET--worker/r-1786776207-a21a734a/work/Stage5_Theorem_Instances/S5-CLM-00003735/statement-crosswalk.json","sha256":"bab9e4820457ea1ff0fc9880085589ea0c62467d68bb302532b1c761f72e77b4","size_bytes":3160},{"media_type":"application/json","path":"/home/sansha/Github/awesome_theorems/.ops/stage5-theorems-execution-v2/tasks/S5THM-00003735-TARGET--worker/r-1786776207-a21a734a/work/Stage5_Theorem_Instances/S5-CLM-00003735/anchor-audit.json","sha256":"a3a78c51fc5192bbea640c8ff75985466ed695be809d1ab29fcc0fc4017887e9","size_bytes":1112},{"media_type":"application/json","path":"/home/sansha/Github/awesome_theorems/.ops/stage5-theorems-execution-v2/tasks/S5THM-00003735-TARGET--worker/r-1786776207-a21a734a/work/Stage5_Theorem_Instances/S5-CLM-00003735/proof-units.json","sha256":"d7eefb617cfdb33416b06a1cd248ed2ca6e6c7c0e994bdce0471150ef310b27e","size_bytes":1311},{"media_type":"text/plain","path":"/home/sansha/Github/awesome_theorems/.ops/stage5-theorems-execution-v2/tasks/S5THM-00003735-TARGET--worker/r-1786776207-a21a734a/work/Stage5_Theorem_Instances/S5-CLM-00003735/process-audit.md","sha256":"d691b2ede87a8ec20c851bd0cdad99193fd4b93a41787e50df764c4b2dabb218","size_bytes":928},{"media_type":"text/x-lean","path":"/home/sansha/Github/awesome_theorems/.ops/stage5-theorems-execution-v2/tasks/S5THM-00003735-TARGET--worker/r-1786776207-a21a734a/work/Formalizations/Lean/AwesomeTheorems/Stage5/Theorems/S5_CLM_00003735/Proof.lean","sha256":"ec7c7d159234547b58e4d4f30e1c3b075f77ec438f77ef281352c4a08349d503","size_bytes":725},{"media_type":"application/json","path":"/home/sansha/Github/awesome_theorems/.ops/stage5-theorems-execution-v2/tasks/S5THM-00003735-TARGET--worker/r-1786776207-a21a734a/work/Stage5_Theorem_Instances/S5-CLM-00003735/machine-closure.json","sha256":"c8c3bfa9c00c62c336347f87d44dc8721220d9e9b340c702d8c246c8c46347dc","size_bytes":1934},{"media_type":"text/plain","path":"/home/sansha/Github/awesome_theorems/.ops/stage5-theorems-execution-v2/tasks/S5THM-00003735-TARGET--worker/r-1786776207-a21a734a/work/Stage5_Theorem_Instances/S5-CLM-00003735/machine-checked-audit.md","sha256":"a7afc9050c177b04622bb1ca41fd781e2c06f27ff90e940e52551eee2e6c33d2","size_bytes":636},{"media_type":"text/plain","path":"/home/sansha/Github/awesome_theorems/.ops/stage5-theorems-execution-v2/tasks/S5THM-00003735-TARGET--worker/r-1786776207-a21a734a/work/Stage5_Theorem_Instances/S5-CLM-00003735/proof-outline.md","sha256":"cf86585cf4e3006f28a224d1de6be11706af738ca123c07f754580f814a52f50","size_bytes":729},{"media_type":"text/plain","path":"/home/sansha/Github/awesome_theorems/.ops/stage5-theorems-execution-v2/tasks/S5THM-00003735-TARGET--worker/r-1786776207-a21a734a/work/Stage5_Theorem_Instances/S5-CLM-00003735/full-study.md","sha256":"c5c796673f58683ec19bf4e68765c4de17749dd92b29fb4c90798f6743614127","size_bytes":1664},{"media_type":"application/json","path":"/home/sansha/Github/awesome_theorems/.ops/stage5-theorems-execution-v2/tasks/S5THM-00003735-TARGET--worker/r-1786776207-a21a734a/work/Stage5_Theorem_Instances/S5-CLM-00003735/readability-review.json","sha256":"db43e5b7ce780d64707880ec8baeb68d0b7cea48ae19879e6df5a099bf1443ed","size_bytes":2733},{"media_type":"text/x-lean","path":"/home/sansha/Github/awesome_theorems/.ops/stage5-theorems-execution-v2/tasks/S5THM-00003735-TARGET--worker/r-1786776207-a21a734a/work/Formalizations/Lean/AwesomeTheorems/Stage5/Theorems/S5_CLM_00003735/Audit.lean","sha256":"a521e48ffef6b324f1e7130c2a92b262fbde02a0fd01f06af082302939af92f0","size_bytes":451},{"media_type":"text/plain","path":"/home/sansha/Github/awesome_theorems/.ops/stage5-theorems-execution-v2/tasks/S5THM-00003735-TARGET--worker/r-1786776207-a21a734a/work/Stage5_Theorem_Instances/S5-CLM-00003735/build-validation.md","sha256":"e73607ea255046074104b60dee342679e489a7665ea1c9596c7efeb63d095895","size_bytes":597},{"media_type":"application/json","path":"/home/sansha/Github/awesome_theorems/.ops/stage5-theorems-execution-v2/tasks/S5THM-00003735-TARGET--worker/r-1786776207-a21a734a/work/Stage5_Theorem_Instances/S5-CLM-00003735/receipts/current-validation.json","sha256":"6c4b303ab6e780a709887eb58249cda9fb82505131d58c805dc24f54bbd0c99f","size_bytes":671},{"media_type":"text/plain","path":"/home/sansha/Github/awesome_theorems/.ops/stage5-theorems-execution-v2/tasks/S5THM-00003735-TARGET--worker/r-1786776207-a21a734a/work/Stage5_Theorem_Instances/S5-CLM-00003735/README.md","sha256":"3f4b7d604420aaba7ff81d551b91c87786b002969c6af303fd3c06759c584ed1","size_bytes":514},{"media_type":"application/json","path":"/home/sansha/Github/awesome_theorems/.ops/stage5-theorems-execution-v2/tasks/S5THM-00003735-TARGET--worker/r-1786776207-a21a734a/work/Stage5_Theorem_Instances/S5-CLM-00003735/meta.json","sha256":"bfb2e61fe1d7df5e107fc6abb72d395955becdbe9ce61b31986975b435cfa03f","size_bytes":1179},{"media_type":"application/json","path":"/home/sansha/Github/awesome_theorems/.ops/stage5-theorems-execution-v2/tasks/S5THM-00003735-TARGET--worker/r-1786776207-a21a734a/work/Stage5_Theorem_Instances/S5-CLM-00003735/receipts/release-decision.json","sha256":"f8cc5b56cfe15c8f475ddd0afcb9755513235ced8ac560cb7047ecadb83759d5","size_bytes":1095}],"authority_sha256":"7fd698985d0fce6040c8e29fcaa495235422d55644cb3b831df777a31cc33fe0","baseline_sha256":"35ab920f80fdd65888d0eace597a19b813ec968913c6c5278e71196678cebc24","changed_paths":["Stage5_Theorem_Instances/S5-CLM-00003735/intake.json","Formalizations/Lean/AwesomeTheorems/Stage5/Theorems/S5_CLM_00003735/Statement.lean","Stage5_Theorem_Instances/S5-CLM-00003735/statement-crosswalk.json","Stage5_Theorem_Instances/S5-CLM-00003735/anchor-audit.json","Stage5_Theorem_Instances/S5-CLM-00003735/proof-units.json","Stage5_Theorem_Instances/S5-CLM-00003735/process-audit.md","Formalizations/Lean/AwesomeTheorems/Stage5/Theorems/S5_CLM_00003735/Proof.lean","Stage5_Theorem_Instances/S5-CLM-00003735/machine-closure.json","Stage5_Theorem_Instances/S5-CLM-00003735/machine-checked-audit.md","Stage5_Theorem_Instances/S5-CLM-00003735/proof-outline.md","Stage5_Theorem_Instances/S5-CLM-00003735/full-study.md","Stage5_Theorem_Instances/S5-CLM-00003735/readability-review.json","Formalizations/Lean/AwesomeTheorems/Stage5/Theorems/S5_CLM_00003735/Audit.lean","Stage5_Theorem_Instances/S5-CLM-00003735/build-validation.md","Stage5_Theorem_Instances/S5-CLM-00003735/receipts/current-validation.json","Stage5_Theorem_Instances/S5-CLM-00003735/README.md","Stage5_Theorem_Instances/S5-CLM-00003735/meta.json","Stage5_Theorem_Instances/S5-CLM-00003735/receipts/release-decision.json"],"claim_card_sha256":"1c69b5a91935dd945f4669f269ace349617e028a63b864de5d980804744902cc","claim_id":"S5THM-00003735-TARGET--worker","command_outcomes":[{"argv_sha256":"a0ba5b58a88f09aaaa015e65b8c852d71ee45ba834cd25ee72a129d686734557","command_id":"complete-target-semantic-proof-debt","exit_code":0,"finished_at":"2026-08-15T07:16:36Z","passed":true,"started_at":"2026-08-15T07:16:36Z","stderr_sha256":"e3b0c44298fc1c149afbf4c8996fb92427ae41e4649b934ca495991b7852b855","stdout_sha256":"cff63552be536ad696e8b9938522dd4eb68feff30af401ae9ae6cee972529af9"}],"completed_at":"2026-08-15T07:16:36Z","item_id":"S5THM-00003735-TARGET","mode":"TARGET-TARGET","patch":{"path":"/home/sansha/Github/awesome_theorems/.ops/stage5-theorems-execution-v2/tasks/S5THM-00003735-TARGET--worker/r-1786776207-a21a734a/changes.patch","sha256":"c4812f97268ab37469ec1f59db5008336d38a46f5d06fd689861da1470796573","size_bytes":28159},"program":"stage5-theorem-proof-debt/2.0","run_id":"r-1786776207-a21a734a","schema_version":"awesome-theorems/stage5-proof-debt-worker-result/1.0","status":"self_tested"}
