{
  "artifacts": [
    {
      "media_type": "application/json",
      "path": "/home/sansha/Github/awesome_theorems/.ops/stage5-theorems-execution-v1/tasks/S5THM-00003491-INTAKE--producer/r-1786400758-4b46e399/work/Stage5_Theorem_Instances/S5-CLM-00003491/intake.json",
      "sha256": "743dd77e99920220b6418744307180573bac5042b9a1c6868035778460711235",
      "size_bytes": 3559
    }
  ],
  "authority_sha256": "6b877e01f6ceecb5c531f980a2e8ae048eb1a40bb5e16ab52f394b2978e21c7f",
  "baseline_sha256": "7d67787e389718e0ba330c49f474c9fc9300f13546b3426dda167751b9bbd85f",
  "changed_paths": [
    "Stage5_Theorem_Instances/S5-CLM-00003491/intake.json"
  ],
  "claim_card_sha256": "18f6e9bffec6bbfa747601c24cc178ec62ca92e474e54345166a5dd6c979ebba",
  "claim_id": "S5THM-00003491-INTAKE--producer",
  "command_outcomes": [
    {
      "argv_sha256": "1e69549351da9206eed30b7f483b8b4671b65b634684fe3aa007753d0600ef6d",
      "command_id": "stage5-phase-gate",
      "exit_code": 0,
      "finished_at": "2026-08-10T22:30:04Z",
      "passed": true,
      "started_at": "2026-08-10T22:30:04Z",
      "stderr_sha256": "e3b0c44298fc1c149afbf4c8996fb92427ae41e4649b934ca495991b7852b855",
      "stdout_sha256": "13f0f953050b9bfd381178bc8229b34b48c8c47813e3b18b365b5bb466a6b171"
    }
  ],
  "completed_at": "2026-08-10T22:30:04Z",
  "item_id": "S5THM-00003491-INTAKE",
  "mode": "TARGET-INTAKE",
  "patch": {
    "path": "/home/sansha/Github/awesome_theorems/.ops/stage5-theorems-execution-v1/tasks/S5THM-00003491-INTAKE--producer/r-1786400758-4b46e399/work/_outbox/changes.patch",
    "sha256": "7f27c0cf4ddb225cee8d51daa55cc96f1d9fceaa40ac1cc6332b42fedf11d56b",
    "size_bytes": 3719
  },
  "program": "stage5-theorem-proof-debt/1.0",
  "run_id": "r-1786400758-4b46e399",
  "schema_version": "awesome-theorems/stage5-proof-debt-worker-result/1.0",
  "status": "self_tested"
}
